{
  "$schema": "https://android-tool-suite.test/contracts/manifest-v3.schema.json",
  "format": "ats-plugin",
  "formatVersion": 3,
  "plugin": {
    "id": "sample.hello_web",
    "title": "Hello Web",
    "description": "不调用 ATS API 的离线示例。",
    "version": "1.0.0",
    "versionCode": 1,
    "minHostVersionCode": 23,
    "publisher": "android_tool_suite.samples",
    "kind": "tool"
  },
  "platforms": ["android"],
  "runtime": {
    "ui": [
      { "id": "main", "type": "declarative", "entry": "ui/main.json" }
    ],
    "background": [],
    "providers": []
  },
  "requires": { "plugins": [], "capabilities": [] },
  "provides": { "capabilities": [] },
  "contributes": {
    "tools": [
      { "id": "main", "uiEntry": "main" }
    ],
    "homeWidgets": []
  },
  "datasets": [],
  "tasks": []
}
